{
  "project_id": "EXAMPLE-FRIDGE-001",
  "scene_id": "S5",
  "asset_id": "A5",
  "entity_ids": [
    "fridge_01"
  ],
  "visual_goal": "Compare rear and side heat-rejection layouts while preserving the same refrigerator as the main visual anchor.",
  "reference_assets": [
    {
      "asset_id": "A1",
      "project_id": "EXAMPLE-FRIDGE-001",
      "scene_id": "S1",
      "asset_role": "anchor",
      "status": "approved",
      "entity_ids": [
        "fridge_01"
      ],
      "parent_asset_ids": [],
      "attempt": 0,
      "provenance": {
        "provider_id": "manual-chatgpt-image",
        "provider_mode": "manual",
        "operation": "generate_anchor",
        "source_uri": null,
        "prompt_snapshot": "See anchor-provider-job.json",
        "notes": "Synthetic approved manifest for workflow demonstration; actual binary image is not stored in this repository."
      },
      "file": {
        "uri": "assets/A1.png",
        "mime_type": "image/png",
        "width": 1080,
        "height": 1920,
        "checksum": null
      },
      "qa_result_ids": [
        "QA-VIS-A1"
      ]
    }
  ],
  "visual_transforms": [
    "rear versus side heat-rejection overlays"
  ],
  "preserved_features": [
    "same fridge body",
    "same finish",
    "same proportions"
  ],
  "forbidden_variations": [
    "change to stainless-steel finish",
    "change to French-door or side-by-side layout",
    "change door count or proportions",
    "replace with a different refrigerator model",
    "move to an unrelated kitchen without a context switch",
    "alter component locations merely for visual convenience"
  ],
  "continuity_constraints": [
    "All physical refrigerator scenes must derive from A1 or an approved derivative.",
    "Technical abstractions should preserve the recognizable fridge_01 silhouette when shown together with the appliance.",
    "Scene 5 may compare heat-rejection layouts but must keep fridge_01 as the primary example."
  ],
  "technical_constraints": [
    "Show rear-versus-side heat-rejection locations as a comparison overlay on the same fridge_01 body.",
    "Do not imply that every refrigerator uses both layouts simultaneously.",
    "Do not introduce a second refrigerator model."
  ],
  "output_spec": {
    "aspect_ratio": "9:16",
    "width": 1080,
    "height": 1920,
    "transparent_background": false
  },
  "attempt": 0
}