{
  "project_id": "EXAMPLE-FRIDGE-001",
  "scene_id": "S6",
  "asset_id": "A6",
  "entity_ids": [
    "fridge_01"
  ],
  "visual_goal": "Return to the exterior and show warmth as a normal consequence at the designed heat-rejection surface.",
  "reference_assets": [
    {
      "asset_id": "A1",
      "project_id": "EXAMPLE-FRIDGE-001",
      "scene_id": "S1",
      "asset_role": "anchor",
      "status": "approved",
      "entity_ids": [
        "fridge_01"
      ],
      "parent_asset_ids": [],
      "attempt": 0,
      "provenance": {
        "provider_id": "manual-chatgpt-image",
        "provider_mode": "manual",
        "operation": "generate_anchor",
        "source_uri": null,
        "prompt_snapshot": "See anchor-provider-job.json",
        "notes": "Synthetic approved manifest for workflow demonstration; actual binary image is not stored in this repository."
      },
      "file": {
        "uri": "assets/A1.png",
        "mime_type": "image/png",
        "width": 1080,
        "height": 1920,
        "checksum": null
      },
      "qa_result_ids": [
        "QA-VIS-A1"
      ]
    }
  ],
  "visual_transforms": [
    "return to rear view",
    "subtle warmth highlight"
  ],
  "preserved_features": [
    "A1 appearance",
    "rear three-quarter view"
  ],
  "forbidden_variations": [
    "change to stainless-steel finish",
    "change to French-door or side-by-side layout",
    "change door count or proportions",
    "replace with a different refrigerator model",
    "move to an unrelated kitchen without a context switch",
    "alter component locations merely for visual convenience"
  ],
  "continuity_constraints": [
    "All physical refrigerator scenes must derive from A1 or an approved derivative.",
    "Technical abstractions should preserve the recognizable fridge_01 silhouette when shown together with the appliance.",
    "Scene 5 may compare heat-rejection layouts but must keep fridge_01 as the primary example."
  ],
  "technical_constraints": [
    "Return to the canonical rear three-quarter view.",
    "Use only a subtle warm-surface highlight; do not use flames, glowing metal, or exaggerated heat effects.",
    "Keep the environment and refrigerator geometry identical to A1."
  ],
  "output_spec": {
    "aspect_ratio": "9:16",
    "width": 1080,
    "height": 1920,
    "transparent_background": false
  },
  "attempt": 0
}